{"base_image":{"digest":"sha256:7a0f0fdd2771464b6976625c2b2d5dd46f566aa00fbc53eceab86ef50883da90","platform":"linux/amd64","repository":"docker.io/vllm/vllm-openai"},"build":{"benchmark_execution":false,"encryption":"AES256","model_download":false,"network":"buildkit-default-no-runtime-workload","platform":"linux/amd64","scan_on_push":true,"source_date_epoch":1786122961,"tag_mutability":"IMMUTABLE"},"buildx_metadata_sha256":"30e0c9578b81644af6b4cfeeaeae5f6f2c826ee9b23b500dc2d6b794ac96697e","digest_approval":{"record_sha256":"28fd3f2530b921a7f8168f6d55ead6b8874b283d7d1675c1b2f4adbeb75c4f0d","signature_ed25519_b64":"NUvIgLu7aEnhZkmQY9bQ+wripxJMokHzJmutAcE35aZjkaVxsrNF2zqPNuBztla2VyIrtDsMC1tWkYP2+3zGBQ==","signed_payload_sha256":"22a69dd86248874d8f7c490f946c74ba696beaae796d444c1529b2dd6f75df04","signer":{"algorithm":"ED25519_SHA_512","key_id":"alias/pneuma-approver","provider":"aws-kms"}},"dockerfile":"infra/docker/controller/Dockerfile","evidence_class":"production_surface_non_scientific","image_digest":"sha256:4635280da46434915b587ea60c11f5ba85fd1d35975b6d26d8c8cefc499fb76d","image_ref":"892077329800.dkr.ecr.us-east-1.amazonaws.com/pneuma-official-production-controller@sha256:4635280da46434915b587ea60c11f5ba85fd1d35975b6d26d8c8cefc499fb76d","oci":{"attestation_descriptor_digest":"sha256:355efa57cafa18160d92617723c9ccd6465c155ce278107c52318f1367db9f35","attestation_manifest_sha256":"355efa57cafa18160d92617723c9ccd6465c155ce278107c52318f1367db9f35","attestation_media_type":"application/vnd.oci.image.manifest.v1+json","child_architecture":"amd64","child_digest":"sha256:4635280da46434915b587ea60c11f5ba85fd1d35975b6d26d8c8cefc499fb76d","child_media_type":"application/vnd.oci.image.manifest.v1+json","child_os":"linux","in_toto_statement_digest":"sha256:bad58a3f1c15e62672a9390c1faeaf2e76bba944f8575d692adf2f8deb775d7d","in_toto_statement_media_type":"application/vnd.in-toto+json","root_index_digest":"sha256:5f2de3dc9b7e3117135b60c8e680cbe41d0fc9492550127cf20c60091f712834","root_index_media_type":"application/vnd.oci.image.index.v1+json","root_to_child_verified":true},"provenance":{"attestation_format":"buildkit-in-toto-provenance","builder":"docker-buildx-provenance-mode-max","descriptor_digest":"sha256:355efa57cafa18160d92617723c9ccd6465c155ce278107c52318f1367db9f35","in_toto_statement_digest":"sha256:bad58a3f1c15e62672a9390c1faeaf2e76bba944f8575d692adf2f8deb775d7d","manifest_sha256":"355efa57cafa18160d92617723c9ccd6465c155ce278107c52318f1367db9f35","source_uri":"git:82ae9c8a8266c3352600cece40d79387459a1730"},"record_kind":"cloud_production_image_receipt","role":"controller","schema_version":"0.2.0","source_closure":{"commit":"82ae9c8a8266c3352600cece40d79387459a1730","file_count":1632,"manifest_sha256":"7af50be3a7cfac109274bd3b5ee4e19c715f7269b748f40b07a02ef447a949f3","path":"source-closure.json","tree_object_id":"7920d3b577e9c5a00dadfefa4565db4b67358eff"},"source_commit":"82ae9c8a8266c3352600cece40d79387459a1730","surface_e2e_status":"pending_bounded_surface_e2e"}
