{"base_image":{"digest":"sha256:7a0f0fdd2771464b6976625c2b2d5dd46f566aa00fbc53eceab86ef50883da90","platform":"linux/amd64","repository":"docker.io/vllm/vllm-openai"},"build":{"benchmark_execution":false,"encryption":"AES256","model_download":false,"network":"buildkit-default-no-runtime-workload","platform":"linux/amd64","scan_on_push":true,"source_date_epoch":1786009379,"tag_mutability":"IMMUTABLE"},"buildx_metadata_sha256":"4c427ff48048143bd886d1432f9496f4bf5ce1b39a0ace7d8f80b53fba93d5f9","digest_approval":{"record_sha256":"202ff0a1fbb6374e3030d89326384c93ccc6354685467e0abdcaf2625bc30f3b","signature_ed25519_b64":"fNTu3OqzEF+1+VmTp6tbnCzJj0IbPOJE3j5tJc09/IThwBM8xXDmbZYLXKARH4u+IkHug6WUquoW+0IlUQFaDQ==","signed_payload_sha256":"f0b1828075a927300bf522a542447587dcec13d9fddf6228333103290b3b669e","signer":{"algorithm":"ED25519_SHA_512","key_id":"alias/pneuma-approver","provider":"aws-kms"}},"dockerfile":"infra/docker/model-server/Dockerfile","evidence_class":"production_surface_non_scientific","image_digest":"sha256:577551b30104d4621c8062d7cc0a42e2e4d18b86a630c5122109d87abd0ba011","image_ref":"892077329800.dkr.ecr.us-east-1.amazonaws.com/pneuma-official-production-model-server@sha256:577551b30104d4621c8062d7cc0a42e2e4d18b86a630c5122109d87abd0ba011","oci":{"attestation_descriptor_digest":"sha256:f7de0e1621b8d1c7218b2c10c11c27c7a23c58308dba1bd10cbad1e1a0fdf7ca","attestation_manifest_sha256":"f7de0e1621b8d1c7218b2c10c11c27c7a23c58308dba1bd10cbad1e1a0fdf7ca","attestation_media_type":"application/vnd.oci.image.manifest.v1+json","child_architecture":"amd64","child_digest":"sha256:577551b30104d4621c8062d7cc0a42e2e4d18b86a630c5122109d87abd0ba011","child_media_type":"application/vnd.oci.image.manifest.v1+json","child_os":"linux","in_toto_statement_digest":"sha256:97e213261da0d86711e79bc2d2f1cd87102268e8bacb4717839ef3f73d4c052e","in_toto_statement_media_type":"application/vnd.in-toto+json","root_index_digest":"sha256:d8174d7b40ba7a299913dc9cc44b2996375164cbb844b8fdcdf7653cb4ef462c","root_index_media_type":"application/vnd.oci.image.index.v1+json","root_to_child_verified":true},"provenance":{"attestation_format":"buildkit-in-toto-provenance","builder":"docker-buildx-provenance-mode-max","descriptor_digest":"sha256:f7de0e1621b8d1c7218b2c10c11c27c7a23c58308dba1bd10cbad1e1a0fdf7ca","in_toto_statement_digest":"sha256:97e213261da0d86711e79bc2d2f1cd87102268e8bacb4717839ef3f73d4c052e","manifest_sha256":"f7de0e1621b8d1c7218b2c10c11c27c7a23c58308dba1bd10cbad1e1a0fdf7ca","source_uri":"git:e9876269da7b2a83855034fb844d4647630c2d73"},"record_kind":"cloud_production_image_receipt","role":"model-server","sbom":{"byte_count":15016922,"format":"spdx-json","release_tar_sha256":"bf7b29ff57f06da30918266a0e1c2885a8f99784798d1bdb1628886aa015d788","release_url":"https://github.com/anchore/syft/releases/download/v1.50.0/syft_1.50.0_linux_amd64.tar.gz","sha256":"271d47f4d7de1b12fea1632b2d9555d0f8146a807bae2b7bbafc32d3b8afa80c","tool":"syft","version":"1.50.0"},"schema_version":"0.2.0","source_closure":{"commit":"e9876269da7b2a83855034fb844d4647630c2d73","file_count":1563,"manifest_sha256":"5fb34bfc65c50fe37ffc5190a3ddedffac67b727ff05dfadc8eb90419184d4c9","path":"source-closure.json","tree_object_id":"8745baf8de61b5db780bb377ab719a26e1581700"},"source_commit":"e9876269da7b2a83855034fb844d4647630c2d73","surface_e2e_status":"pending_bounded_surface_e2e"}
