{"base_image":{"digest":"sha256:7a0f0fdd2771464b6976625c2b2d5dd46f566aa00fbc53eceab86ef50883da90","platform":"linux/amd64","repository":"docker.io/vllm/vllm-openai"},"build":{"benchmark_execution":false,"encryption":"AES256","model_download":false,"network":"buildkit-default-no-runtime-workload","platform":"linux/amd64","scan_on_push":true,"source_date_epoch":1786030692,"tag_mutability":"IMMUTABLE"},"buildx_metadata_sha256":"21b8a0fe4ba7737c63d5636d852bd7b2cb78fd487e90c7dd6518e0acfd9404de","digest_approval":{"record_sha256":"5e09ab9ce3e1595e97a1579574a8987560522f8fb78a72e9a7114646b6c358e6","signature_ed25519_b64":"sqP/FQGQPndodhinsbTrU0UAf4SrF7S5y30ZcasdD68R9gY/4OLqv3aSV/S3w4oZmwJEHDWPFh8wAot5EnbfBw==","signed_payload_sha256":"1ba9d2428f8a8edb7d09300042ef6b5ad46ee00edaf39d69389accad8b5aa2e7","signer":{"algorithm":"ED25519_SHA_512","key_id":"alias/pneuma-approver","provider":"aws-kms"}},"dockerfile":"infra/docker/controller/Dockerfile","evidence_class":"production_surface_non_scientific","image_digest":"sha256:c7070db148118b941f23d9f331adc63635dd3d2606927394c011f0e1b9186db6","image_ref":"892077329800.dkr.ecr.us-east-1.amazonaws.com/pneuma-official-production-controller@sha256:c7070db148118b941f23d9f331adc63635dd3d2606927394c011f0e1b9186db6","oci":{"attestation_descriptor_digest":"sha256:2f5f1025d1ca7b8f4846cd5009903bffecb51219798ec90835c94e9fe2a7a0c8","attestation_manifest_sha256":"2f5f1025d1ca7b8f4846cd5009903bffecb51219798ec90835c94e9fe2a7a0c8","attestation_media_type":"application/vnd.oci.image.manifest.v1+json","child_architecture":"amd64","child_digest":"sha256:c7070db148118b941f23d9f331adc63635dd3d2606927394c011f0e1b9186db6","child_media_type":"application/vnd.oci.image.manifest.v1+json","child_os":"linux","in_toto_statement_digest":"sha256:23cc107307a1b9c3a9fbd389088ea0790bd796b36df3e399d6d5b5870b8b305a","in_toto_statement_media_type":"application/vnd.in-toto+json","root_index_digest":"sha256:445dde241cf10f3c30b8e2fd9644e17524be13e005605515b11bb1d989aad084","root_index_media_type":"application/vnd.oci.image.index.v1+json","root_to_child_verified":true},"provenance":{"attestation_format":"buildkit-in-toto-provenance","builder":"docker-buildx-provenance-mode-max","descriptor_digest":"sha256:2f5f1025d1ca7b8f4846cd5009903bffecb51219798ec90835c94e9fe2a7a0c8","in_toto_statement_digest":"sha256:23cc107307a1b9c3a9fbd389088ea0790bd796b36df3e399d6d5b5870b8b305a","manifest_sha256":"2f5f1025d1ca7b8f4846cd5009903bffecb51219798ec90835c94e9fe2a7a0c8","source_uri":"git:253d8f644ef6757e317fda4c81ffea3906fed584"},"record_kind":"cloud_production_image_receipt","role":"controller","sbom":{"byte_count":15013326,"format":"spdx-json","release_tar_sha256":"bf7b29ff57f06da30918266a0e1c2885a8f99784798d1bdb1628886aa015d788","release_url":"https://github.com/anchore/syft/releases/download/v1.50.0/syft_1.50.0_linux_amd64.tar.gz","sha256":"fe693b02f0c410c1f73c73fe43368bc1cb0f03067c564904c9ce946bae6b1d22","tool":"syft","version":"1.50.0"},"schema_version":"0.2.0","source_closure":{"commit":"253d8f644ef6757e317fda4c81ffea3906fed584","file_count":1580,"manifest_sha256":"810399da6fd11ccf1238b01ce8abea157222edc7b3865e14af1d6893245330b0","path":"source-closure.json","tree_object_id":"11dba135c3cb968b5fc0d9e928deb50aa533b6de"},"source_commit":"253d8f644ef6757e317fda4c81ffea3906fed584","surface_e2e_status":"pending_bounded_surface_e2e"}
